{
  "$schema": "https://json-schema.org/draft/2020-12/schema",
  "$id": "https://local.disclosure-anchor/contracts/normalized_ir.v1.json",
  "title": "NormalizedIR v1",
  "type": "object",
  "additionalProperties": true,
  "required": [
    "contract_version",
    "created_at",
    "document_id",
    "elements",
    "parsed_pages",
    "parser",
    "parser_artifacts",
    "source_pdf",
    "title"
  ],
  "properties": {
    "contract_version": {
      "const": "normalized_ir.v1"
    },
    "created_at": {
      "type": "string"
    },
    "document_id": {
      "type": "string"
    },
    "source_pdf": {
      "type": "string"
    },
    "title": {
      "type": ["string", "null"]
    },
    "sample_key": {
      "type": ["string", "null"]
    },
    "sample_role": {
      "type": ["string", "null"]
    },
    "parser": {
      "type": "object",
      "additionalProperties": true,
      "required": ["name", "package_version", "backend", "method", "language", "formula", "table"],
      "properties": {
        "name": {
          "type": "string"
        },
        "package_version": {
          "type": "string"
        },
        "backend": {
          "type": "string"
        },
        "method": {
          "type": "string"
        },
        "language": {
          "type": "string"
        },
        "formula": {
          "type": "boolean"
        },
        "table": {
          "type": "boolean"
        }
      }
    },
    "parser_artifacts": {
      "type": "object",
      "additionalProperties": true
    },
    "parsed_pages": {
      "type": "object",
      "additionalProperties": false,
      "required": ["start_page_no", "end_page_no", "full_pdf"],
      "properties": {
        "start_page_no": {
          "type": ["integer", "null"],
          "minimum": 1
        },
        "end_page_no": {
          "type": ["integer", "null"],
          "minimum": 1
        },
        "full_pdf": {
          "type": "boolean"
        }
      }
    },
    "elements": {
      "type": "array",
      "items": {
        "type": "object",
        "additionalProperties": true,
        "required": ["ir_id", "kind", "order_index", "source_item_index"],
        "properties": {
          "ir_id": {
            "type": "string"
          },
          "kind": {
            "type": "string"
          },
          "order_index": {
            "type": "integer",
            "minimum": 0
          },
          "source_item_index": {
            "type": "integer",
            "minimum": 0
          },
          "page_idx": {
            "type": "integer",
            "minimum": 0
          },
          "page_no": {
            "type": "integer",
            "minimum": 1
          },
          "text": {
            "type": "string"
          },
          "table_html": {
            "type": "string"
          },
          "table_caption": {
            "type": "array"
          },
          "table_footnote": {
            "type": "array"
          },
          "image_path": {
            "type": "string"
          }
        }
      }
    }
  }
}
