{
  "contract_version": "normalized_ir.v1",
  "created_at": "2026-06-30T00:00:00+00:00",
  "document_id": "phase00_annual_report_excerpt",
  "elements": [
    {
      "document_id": "phase00_annual_report_excerpt",
      "ir_id": "annual_report_excerpt_ir_0000",
      "kind": "text",
      "order_index": 0,
      "page_idx": 0,
      "page_no": 1,
      "source_item_index": 0,
      "text": "南通江海电容器股份有限公司"
    },
    {
      "document_id": "phase00_annual_report_excerpt",
      "ir_id": "annual_report_excerpt_ir_0001",
      "kind": "text",
      "order_index": 1,
      "page_idx": 0,
      "page_no": 1,
      "source_item_index": 1,
      "text": "2025 年年度报告"
    },
    {
      "document_id": "phase00_annual_report_excerpt",
      "ir_id": "annual_report_excerpt_ir_0002",
      "kind": "table",
      "order_index": 2,
      "page_idx": 1,
      "page_no": 2,
      "source_item_index": 2,
      "table_caption": [
        "主要会计数据和财务指标"
      ],
      "table_footnote": [],
      "table_html": "<table><tr><td>项目</td><td>2025年</td></tr><tr><td>营业收入</td><td>示例值</td></tr></table>"
    }
  ],
  "parsed_pages": {
    "end_page_no": 2,
    "full_pdf": false,
    "start_page_no": 1
  },
  "parser": {
    "backend": "pipeline",
    "formula": false,
    "language": "ch",
    "method": "auto",
    "name": "MinerU",
    "package_version": "3.4.0",
    "table": true
  },
  "parser_artifacts": {
    "artifact_root_relpath": "parser_artifacts/_phase00/annual_report_excerpt/auto",
    "content_list_relpath": "parser_artifacts/_phase00/annual_report_excerpt/auto/annual_report_excerpt_content_list.json",
    "markdown_relpath": "parser_artifacts/_phase00/annual_report_excerpt/auto/annual_report_excerpt.md"
  },
  "sample_key": "annual_report_excerpt",
  "sample_role": "clean_checkout_fixture",
  "source_pdf": "raw_documents/cninfo/002484/2026/1225087169/sha256_excerpt.pdf",
  "title": "江海股份 2025 年年度报告 excerpt"
}
